Item Number,Context
2.2.4.1.10.1,"a visão do requisitante da aplicação, que pode aceitar ou considerar que a aplicação não cumpre o que foi solicitado, tanto em relação ao atendimento das"
2.2.4.1.10.2,"a visão da informá Ɵca da contratante, principalmente na modelagem de dados e deﬁnição de serviços web, além de adequação de padrões técnicos conhecidos"
2.2.4.1.10.3,"havendo elaboração de artefatos, a capacidade de reconhecimento de cada elemento (requisito técnico, funcional, regra de negócio etc.) e a compreensão"
2.2.4.1.10.4,A composição de Ɵmes ágeis e a previsão dos custos por sprint está explicitado no item 4 do APÊNDICE I deste TR.
2.3,Especiﬁcações Técnicas
2.3.1,Considerações Gerais
2.3.1.1,"A contratada é responsável pela boa prestação dos serviços aqui descritos, devendo empregar os recursos de pessoal no quan ƟtaƟvo necessário, e com a qualiﬁcação"
2.3.1.2,"A plataforma, inicialmente, deverá funcionar em uma infraestrutura de nuvem dedicada e controlada pela contratada na forma de PaaS (Paltaform as a Service)."
2.3.1.2.1,"A implantação em infraestrutura de nuvem deve ser de tal forma que a ANS possa contratar o serviço da nuvem, para manter a plataforma em funcionamento, no"
2.3.1.3,Ao ﬁm da relação contratual deve ser possível con Ɵnuar uƟlizando todas as aplicações que foram desenvolvidas na plataforma. Deverá ser possível a execução e a
2.3.1.4,"Em geral, os serviços deverão ser prestados de forma remota, podendo ser necessário, em alguns casos, a prestação presencial na sede da ANS, conforme indicado"
2.3.1.4.1,"Para o contato a distância dos proﬁssionais da contratada com os proﬁssionais da contratante, deverá ser u Ɵlizada a ferramenta de comunicação on-line deﬁnida"
2.3.1.4.2,"A responsabilidade pela disponibilização de ferramenta de comunicação aos proﬁssionais da contratada, conforme citado acima, é da própria contratada."
2.3.1.4.3,A solução deve ter suporte a plataforma no território brasileiro através de meios próprios ou de parceiros.
2.3.1.5,"Excetuando-se alguns dos serviços do Item 1 do Grupo 1 os demais são solicitados por ordens de serviço (OS), e considera-se a mensagem eletrônica (e-mail) como"
2.3.1.5.1,"Em geral, os serviços do Item 1 do Grupo 1 não requerem OS, pois são de execução única, con Ɵnuada ou dependente de evento externo acompanhado pela própria"
2.3.1.6,"O descumprimento dos prazos previstos abaixo, assim como a má qualidade dos serviços prestados, poderão acarretar em penalidades e glosas conforme deﬁnidos"
2.3.1.7,O início da execução dos serviços é considerado a par Ɵr do momento em que efe Ɵvamente começa o trabalho dos técnicos da contratada junto aos técnicos ou
2.3.2,"Caracterís Ɵcas da Plataforma, Infraestrutura e Segurança"
2.3.2.1,"A plataforma deve ser capaz de funcionar em nuvem pública, privada e on-premise, e também de trabalhar de forma híbrida."
2.3.2.2,"A ferramenta pode ser uma plataforma completa, com todas as funcionalidades na Ɵvas, ou ser composta por diversas ferramentas integradas para fornecer todas as"
2.3.2.2.1,"No caso de ferramentas integradas, elas deverão ser livres de licença, ou garan Ɵdas pela distribuição da contratada, não sendo a contratante responsável por"
2.3.2.2.2,"Além disso, deve estar claro que a integração tem de ser transparente para os usuários, como se fosse uma única ferramenta. Havendo qualquer necessidade de"
2.3.2.3,"Capacidade de desenvolvimento, disponibilização e administração de aplicações de forma simples e totalmente integrada."
2.3.2.4,"Possibilidade de ter diversos ambiente como, por exemplo, Desenvolvimento, Homologação, Teste e Produção na mesma plataforma e de criar outros ambientes,"
2.3.2.5,"Gestão de usuários com diferentes perﬁs como desenvolvedor, administrador e usuário ﬁnal, permi Ɵndo restringir ou fornecer acessos conforme o perﬁl."
2.3.2.5.1,"Possibilidade de restringir acesso a projetos por equipe, ou seja, um desenvolvedor, ou equipe de desenvolvedores, pode ter acesso a alguns projetos e aplicações e"
2.3.2.5.2,"Possibilidade de restringir acesso para execução de deploys nos diversos ambientes (desenvolvimento, homologação, produção etc.)."
2.3.2.6,Gerenciamento do por ƞólio de aplicações em todos os ambientes de forma a facilitar a análise de impactos e dependências.
2.3.2.7,"Controle automa Ɵzado de todas as fases de desenvolvimento de aplicações (DevOps), incluindo os testes e até a publicação em ambiente de produção."
2.3.2.8,Gestão de processos e regras de negócio (BPM) de forma visual e integrada ao ambiente de desenvolvimento e com rastreabilidade.
2.3.2.9,"Possibilidade de desenvolvimento de aplicações por pessoas que não sejam proﬁssionais técnicos (ci Ɵzen developer), de forma visual (drag and drop) e sem"
2.3.2.10,Possibilidade de implementação de layouts visando a usabilidade e experiência do usuário através de técnicas e modelos conhecidos e fornecidos na ferramenta.
2.3.2.11,"Facilidade para criação de aplicações web e móveis, e aplicações PWA (“Progressive Web Applica Ɵon”), que sejam responsivas e se adaptem aos diversos Ɵpos de"
2.3.2.11.1,"Capacidade de desenvolver aplicações que trabalhem oﬀ-line no disposi Ɵvo, uƟlizando banco de dados local, e que sejam capazes de sincronizar automa Ɵcamente"
2.3.2.12,"Facilitar a distribuição das aplicações móveis nas principais lojas do mercado de disposi Ɵvos, atualmente Android e iOS."
2.3.2.13,"U Ɵlizar tecnologias atuais para desenvolvimento web e móvel com layout responsivo como HTML5/REACT JS, CSS3/SASS etc. (mantendo a plataforma sempre"
2.3.2.14,"Geração de aplica Ɵvos usando tecnologia padronizada pelo W3C, sem depender de plug-ins ou extensões proprietárias como Java Applets, Java Web Start, Flash,"
2.3.2.15,"Possuir ferramenta visual para criação e manipulação de bases de dados, permi Ɵndo criar e alterar as estruturas de objetos do banco (tabelas, views, campos,"
2.3.2.15.1,"Possibilitar criação de consultas dinâmicas e o Ɵmizadas sem a necessidade de escrever código SQL, contendo os recursos de agrupamento, ordenação, contagem e"
2.3.2.15.2,"Possibilitar visualização prévia das consultas a banco de dados em tempo de desenvolvimento permi Ɵndo ao desenvolvedor aferir, tanto a consulta, quanto o"
2.3.2.16,Possibilitar criação de aplicação com base de dados criada através de exportação de arquivos de planilha ou .CSV criando e executando automa Ɵcamente a lógica
2.3.2.17,Permi Ɵr a simulação da execução do aplica Ɵvo móvel desenvolvido por meio da plataforma em um navegador de internet com a possibilidade de simular os gestos e
2.3.2.18,"Facilidade para criação, consumo e exposição de serviços web nos padrões REST e SOAP, sem necessidade de alteração em código fonte (no-code). Mas, também,"
2.3.2.19,"Facilidade na reu Ɵlização de componentes de aplicações (telas, tabelas de banco de dados, serviços web etc.) e catalogação dos mesmos na plataforma por"
2.3.2.20,"Criação, manutenção e versionamento de códigos fonte e artefatos de projetos, aplicações e componentes sem necessidade de ferramentas externas à plataforma."
2.3.2.21,"Ferramenta para geração de documentação das aplicações e projeto, inclusive descri Ɵvos de processos de negócio, en Ɵdades de banco de dados e seus"
2.3.2.22,"Possibilidade de trabalho em equipe nos projetos, permi Ɵndo que dois ou mais desenvolvedores acessem e façam alterações, em aplicações e outros artefatos do"
2.3.2.23,Permi Ɵr a depuração das aplicações de forma visual e independente para cada usuário da plataforma poder acompanhar o passo a passo de execução de sua
2.3.2.24,"Funcionalidade de desenvolvimento assis Ɵdo (Inteligência Ar Ɵﬁcial) que avalia a aplicação em tempo de desenvolvimento, com o obje Ɵvo de detectar desvios das"
2.3.2.25,"Possibilidade de criar, de forma rápida e fácil, aplicações que u Ɵlizem cer Ɵﬁcação digital, enviem e-mail e sms, além de aplicações com controle de acesso,"
2.3.2.27,"Execução automá Ɵca de testes unitários, funcionais e de segurança (baseado em padrões internacionalmente reconhecidos como OWASP) de forma integrada à"
2.3.2.27.1,"Realização constante de validações sintá Ɵcas e semân Ɵcas, informando o desenvolvedor de possíveis erros e vulnerabilidades na aplicação em desenvolvimento,"
2.3.2.28,"Ambiente fácil e intui Ɵvo para o desenvolvedor programar em código fonte, high code, se necessário."
2.3.2.29,"Capacidade de exportar os códigos fontes das aplicações, sem componentes proprietários, organizados e o Ɵmizados, em linguagem de programação Java ou uma"
2.3.2.30,Administração de aplicações em ambiente de produção de forma a minimizar ao máximo o risco de indisponibilidade.
2.3.2.31,"Fornecimento de relatórios de execução e desempenho, tanto da plataforma, quanto das aplicações que estão rodando nos diversos ambientes, principalmente em"
2.3.2.31.1,"Permi Ɵr o monitoramento das aplicações desenvolvidas, de maneira que seja possível veriﬁcar a ocorrência de erros, o desempenho de telas, consultas a banco de"
2.3.2.31.2,Prover um dashboard centralizado que permite a análise visual do nível de performance do por ƞólio das aplicações web responsivas ao longo do tempo. Deve
2.3.2.32,"Possibilidade de desenvolvimento de aplicações fora das dependências do órgão de forma segura, sem necessidade de VPN."
2.3.2.33,Integração com os serviços do Ac Ɵve Directory para auten Ɵcação e autorização de aplicações e compa Ɵbilidade com os padrões Oauth 2.0 e OpenID-connect.
2.3.2.34,"Compa Ɵbilidade com diversos gerenciadores de banco de dados, sendo obrigatória com Oracle e MySQL, para uso das aplicações criadas na plataforma."
2.3.2.35,"A plataforma deve ser independente de tecnologias proprietárias de terceiros, tais como, servidores de aplicações ou interpretadores."
2.3.2.36,"Prover um mecanismo de feedback, permi Ɵndo que usuários de negócio possam fazer comentários e anotações na aplicação, possibilitando aos desenvolvedores"
2.3.2.37,"Prevenção de segurança, tanto para a plataforma, quanto para as aplicações nela desenvolvidas, contra acessos indevidos e ameaças, como ﬁshing, ataques DDoS,"
2.3.2.38,"Permi Ɵr a deﬁnição do nível de segurança de páginas por meio do uso de HTTPS e SSL, com ou sem cer Ɵﬁcado do cliente, assim como alertar sobre possíveis"
2.3.2.39,"Disponibilizar repositório de componentes, conectores, widgets, no modelo de Marketplace, sem a necessidade de duplicação de código, contendo objetos"
2.3.2.39.1,"Todos os elementos que forem u Ɵlizados nos aplica Ɵvos da contratante devem ser livres de licença, ser de propriedade da contratante ou ter permissão para uso"
2.3.2.40,"O provedor do serviço deve possuir as seguintes cer Ɵﬁcações ISO 27001, 27017 e 27018."
2.3.2.41,O provedor do serviço deve ser membro da CSA (Cloud Security Alliance) ou possuir cer Ɵﬁcação CSA STAR.
3,JUSTIFICATIVA PARA A CONTRATAÇÃO
3.1,Contextualização e Jus ƟﬁcaƟva da Contratação
3.1.1,"Atualmente toda ins Ɵtuição no mundo requer, para servir bem aos propósitos a que foram criadas, soluções de so Ōware que automa Ɵzem suas a Ɵvidades e propiciem"
3.1.2,"A ANS vem, desde 2011, buscando melhorias no processo de desenvolvimento de sistemas, em vista a adequar-se às legislações e normas per Ɵnentes, reduzir o prazo"
3.1.3,"Em vista disso, adotou-se há alguns anos a metodologia de desenvolvimento ágil, que cumpriu seu papel e ajudou a reduzir prazos de entrega e algumas outras"
3.1.4,"Neste contexto que entram as plataformas low-code, com sua capacidade de tornar mais célere a construção do so Ōware e sua entrada em produção, u Ɵlizando-se de"
3.1.5,"Devido aos riscos levantados no estudo técnico preliminar elaborado no planejamento desta contratação, e com base nos princípios da Economicidade e Eﬁciência,"
3.1.6,"Devido às diﬁculdades encontradas no passado com contratações mensuradas em pontos de função e aos acórdãos 2.037/2019 e 1.508/2020 do Plenário do TCU, que"
3.2,Alinhamento aos Instrumentos de Planejamento Ins Ɵtucionais
3.2.1,Esta contratação está alinhada aos seguintes instrumentos de planejamento ins Ɵtucional:
3.3,EsƟmaƟva de demanda
3.4,A esƟmaƟva de demanda está descrita no APÊNDICE II do TR.
3.5,Parcelamento da Solução de TICSEI/ANS - 27143694 - Edital de Licitação https://sei.ans.gov.br/controlador.php?acao=documento_imprimir_w...
3.7,Resultados e Bene İcios a Serem Alcançados
3.7.1,"Espera-se com essa contratação, que a ANS seja capaz de agilizar seu processo de transição digital, melhorando a automação dos processos existentes com o"
4,ESPECIFICAÇÃO DOS REQUISITOS DA CONTRATAÇÃO
4.1,Requisitos de Negócio
4.1.1,Necessidade de automação e/ou melhoria na automação dos processo de trabalho das diversas áreas.
4.1.2,Necessidade de melhoria na troca de informações com os entes regulados e a sociedade em geral u Ɵlizando-se de sistemas de informação.
4.1.3,"Desenvolvimento de diversas aplicações novas, além de manutenções evolu Ɵvas, corre Ɵvas e adapta Ɵvas para adequação aos processos das áreas de negócio e da TI."
4.2,Requisitos de capacitação
4.2.1,"Em face da natureza dos serviços a serem contratados, que exige rápida e permanente atualização frente às novas tecnologias de informação, e visando manter a"
4.2.2,"A CONTRATANTE deverá informar à CONTRATADA qualquer subs Ɵtuição de ferramenta, so Ōware básico, sistemas operacionais, metodologias e outros com"
4.2.3,"A contratada poderá solicitar adequação dos proﬁssionais quanto a u Ɵlização de novas tecnologias, ferramentas de apoio, gerenciamento de projeto, desenvolvimento"
4.2.4,"Uma lista exemplo seria: metodologia ágil, análise de ponto de função, suporte à requisitos, controle de versionamento, ferramentas de apoio e automa Ɵzação de"
4.2.5,"As ações de treinamento/reciclagem serão de responsabilidade da Contratada, e não deverá constar em sua planilha de custos, uma vez que existe vedação legal ao"
4.3,Requisitos Legais
4.3.1,Lei de licitações e contratos administra Ɵvos 8.666 de 21 de junho de 1993. 4.3.2. Lei nº 10.520/2002.
4.3.3,Instrução norma Ɵva nº 1 de 4 de abril de 2019 do Ministério da Economia (ME).
4.3.4,Decreto nº 7.174 de 12 de maio de 2010.
4.3.5,"Decreto nº 9.507, de 2018."
4.3.6,Portaria nº 5.651 de 28 de junho de 2022 da SGD/ME.
4.3.7,"Instrução Norma Ɵva nº 5 de 26 de maio de 2017 do Ministério do Planejamento, Desenvolvimento e Gestão."
4.4,Requisitos de Manutenção
4.4.1,"Buscando con Ɵnuidade no fornecimento da solução de TIC em caso de falha, a ANS possui um contrato para a Sustentação dos Sistemas Corpora Ɵvos para realização"
4.5,Requisitos Temporais
4.5.1,Horários
4.5.1.1,"As a Ɵvidades que forem executadas nas dependências da contratante, ou que necessitem de interação direta com a mesma, deverão ocorrer dentro do horário de"
4.5.1.2,"A interação da contratada com determinada equipe ou ﬁscal da contratante deverá respeitar o horário de trabalho dos mesmos, cabendo à contratada planejar-se de"
4.5.1.3,"Em casos especiais, principalmente nas a Ɵvidades de apoio ao ambiente de produção, poderão ser executadas ações fora do horário de funcionamento normal da"
4.5.1.4,"Em relação às a Ɵvidades que ocorrem fora das dependências da contratante, e que não envolvam contato com funcionários desta, cabe à contratada deﬁnir seus"
4.5.2,Prazos
4.5.2.1,"Os prazos rela Ɵvos às aƟvidades desta contratação estão elencados na seção ""ESPECIFICAÇÕES TÉCNICAS"" deste TR."
4.5.2.2,O início das a Ɵvidades da contratada deverá ocorrer em até 5 dias corridos da assinatura do contrato.
4.5.2.3,A contratada deve apresentar o preposto para a contratante em até 2 dias úteis da assinatura do contrato.
4.5.2.4,A vigência do contrato será de:
4.6,Requisitos de Segurança e Privacidade
4.6.1,A CONTRATADA deverá seguir os requisitos de segurança da informação listados abaixo:
4.6.1.1,"Cumprir o que se dispõe na Lei Geral de Proteção de Dados Pessoais (LGPD) nº 13.853/2019, realizando o tratamento de informações classiﬁcadas e proteção de"
4.6.1.2,"A CONTRATADA também deverá seguir as orientações da RESOLUÇÃO ADMINISTRATIVA – RA Nº 62, DE 2 DE JUNHO DE 2015, ou versões atualizadas posteriormente,"
4.6.1.3,A CONTRATANTE se reserva o direito de realizar auditoria de Segurança da Informação e Privacidade (SIP) rela Ɵva à conformidade dos requisitos de segurança da
4.6.1.4,"Evitar vazamento de informações mantendo sigilo e privacidade, sob pena de responsabilidade civil, penal e administra Ɵva, sobre todo e qualquer assunto de"
4.6.1.5,"Fornecer as soluções de acordo com as polí Ɵcas de segurança da informação da CONTRATANTE inclusive no que cerne a registros de log e controles criptográﬁcos,SEI/ANS - 27143694 - Edital de Licitação https://sei.ans.gov.br/controlador.php?acao=documento_imprimir_w..."
4.6.1.6,"No que tange as obrigações da SIP, a CONTRATADA deve propiciar a disponibilidade da solução de TIC e garan Ɵr a conƟnuidade da solução implementada."
4.6.1.7,"Seguir a Polí Ɵca de Segurança da Informação (POSIN) da CONTRATANTE, ou equivalente, aderente ao disposto na IN GSI/PR nº 1, de 27 de maio de 2020, incluindo"
4.6.1.8,"Realizar, em conjunto com a CONTRATANTE, análise de impacto na privacidade dos dados pessoais relacionada à Solução de TIC, considerando o descrito pelo"
4.6.1.9,"No processo referente a migração dos dados do sistema legado para o novo sistema, deverá possuir e implementar processo de gestão de mudanças adequado para"
4.6.1.10,"Possuir e manter trilhas de qualidade e teste de so Ōware, e realizar desenvolvimento seguro, aderente ao disposto em disposi Ɵvo legal correlato publicado pelo"
4.6.1.11,"Os dados pessoais u Ɵlizados em ambiente de TDH (teste, desenvolvimento e homologação) devem passar por um processo de anonimização."
4.6.1.12,"A u Ɵlização dos dados pessoais em ambiente de TDH (teste, desenvolvimento e homologação), não anonimizados, deve ser autorizada pelo proprietário do a Ɵvo de"
4.6.1.13,"U Ɵlizar técnicas ou métodos apropriados para garan Ɵr exclusão ou destruição segura de dados pessoais (incluindo originais, cópias e registros arquivados), de modo"
4.6.1.14,"A aplicação desenvolvida pela CONTRATADA deverá ter funcionalidade para, ao fornecer a base de informações para órgãos de pesquisa, os dados pessoais sejam"
4.6.1.15,"Possuir e implementar polí Ɵca de privacidade que atenda aos princípios da Lei Geral de Proteção de Dados Pessoais (LGPD), a ser homologada pelo órgão"
4.6.1.16,"Implementar controles de acesso baseados em uma polí Ɵca de controle de acesso para o objeto contratado, elaborada pela CONTRATANTE em conjunto com a"
4.6.1.17,"A polí Ɵca deve estabelecer, dentre outros critérios, que se deve conceder autorizações de acesso apenas quando realmente sejam necessárias para o desempenho"
4.6.1.18,"A polí Ɵca também deve deﬁnir situações e protocolos para acesso a informações sensíveis, necessidades de não repúdio, situações que requerem auten Ɵcação via"
4.6.1.19,"U Ɵlizar recursos de segurança da informação e de tecnologia da informação de qualidade, eﬁciência e eﬁcácia reconhecidas e em versões comprovadamente"
4.6.1.20,"Reportar de imediato à CONTRATANTE incidentes que envolvam vazamento de dados, indisponibilidade ou comprome Ɵmento da informação relacionados à Solução"
4.6.1.21,O tratamento de incidentes de segurança da informação será realizado através da ferramenta de gestão de incidentes da ANS.
4.6.1.22,Implementar e manter controles e procedimentos especíﬁcos para assegurar completo e absoluto sigilo quanto a todos os dados e informações de que o preposto
4.6.1.23,Deﬁnir e executar procedimento de descarte seguro dos dados pessoais ou sigilosos da CONTRATANTE ao encerrar a execução do contrato.
4.6.1.24,"Comunicar à CONTRATANTE, de imediato, a ocorrência de transferência, promoção, remanejamento ou demissão de funcionário, para que seja providenciada a"
4.6.1.25,Informar e obter a anuência do órgão CONTRATANTE sobre a u Ɵlização de serviços de terceiros para sustentar ou viabilizar o funcionamento da Solução de TIC.
4.6.1.26,"Implementar e manter, em conjunto com a CONTRATANTE, controles e procedimentos especíﬁcos para assegurar a segurança İsica e do ambiente de acesso às"
4.6.1.27,"Apresentar à CONTRATANTE, sempre que solicitado, toda e qualquer informação e documentação que comprovem a implementação dos requisitos de SIP"
4.6.1.28,"Realizar, em conjunto com a CONTRATANTE, ou com outros órgãos por ela indicados, ações de tratamento de incidentes de SIP relacionados ao objeto do contrato,"
4.6.1.29,"A CONTRATADA deverá res Ɵtuir imediatamente à CONTRATANTE, quando do término do serviço ou quando for solicitada, qualquer informação conﬁdencial"
4.6.1.30,Indicar as diretrizes que deverão ser seguidas pela CONTRATADA para o desenvolvimento de so Ōware seguro.
4.6.1.31,"O CONTRATANTE e a CONTRATADA realizarão a análise de impacto na proteção dos dados pessoais relacionada à Solução de TIC, devendo considerar as informações"
4.6.1.32,A não observância do disposto sobre conﬁdencialidade torna a PARTE infratora sujeita às penalidades cabíveis previstas em lei.
4.7,"Requisitos Sociais, Ambientais e Culturais"
4.7.1,"A Contratada deverá atender, no que couber, o critério de sustentabilidade ambiental previsto na Instrução Norma Ɵva SLTI/MPOG nº 01, de 19 de janeiro de 2010."
4.8,Requisitos de Arquitetura Tecnológica
4.8.1,"Nos casos em que, por conveniência e oportunidade desta Autarquia, venha a ocorrer ajustes nos serviços executados de forma remota para a forma de execução"
4.9,Requisitos de Projeto e de Implementação
4.9.1,As a Ɵvidades deverão ser executadas conforme metodologia ágil e as deﬁnições do APÊNDICE I.
4.10,Requisitos de Implantação
4.10.1,"É parte do objeto da contratação em tela a implantação do novo serviço/tecnologia de TIC, que traz inovação para a Agência. Os requisitos serão deﬁnidos"
4.11,Requisitos de Garan Ɵa e ManutençãoSEI/ANS - 27143694 - Edital de Licitação https://sei.ans.gov.br/controlador.php?acao=documento_imprimir_w...
4.11.1.1,A garan Ɵa dos produtos entregues nos contratos originados por este documento dá-se por até 90 dias corridos após o ﬁm da vigência do contrato.
4.11.1.2,"A garan Ɵa técnica cobre erros ou falhas de funcionamento nos produtos desenvolvidos, não atendimento à visão do usuário, problemas de usabilidade, além do"
4.11.1.3,"As a Ɵvidades necessárias para a execução da garan Ɵa não geram custo para a contratante, sendo executadas totalmente às expensas da contratada."
4.11.1.4,"Os chamados para execução de garan Ɵa técnica devem ser atendidos de imediato pela contratada, sendo considerado o prazo de 1 dia ú Ɵl para conhecimento da"
4.11.1.4.2,"O não atendimento das condições da garan Ɵa técnica poderão incidir nos indicadores de nível de serviço, conforme avaliação da EGC, sem prejuízo das sanções"
4.11.2,GaranƟa da execução
4.11.2.1,"A Contratada apresentará, no prazo máximo de 10 (dez) dias úteis, prorrogáveis por igual período, a critério do Contratante, contado da assinatura do contrato,"
4.11.2.2,"A inobservância do prazo ﬁxado para apresentação da garan Ɵa acarretará a aplicação de multa de 0,07% (sete centésimos por cento) do valor total do contrato por"
4.11.2.3,O atraso superior a 25 (vinte e cinco) dias autoriza a Administração a promover a rescisão do contrato por descumprimento ou cumprimento irregular de suas
4.11.2.4,"A garan Ɵa assegurará, qualquer que seja a modalidade escolhida, o pagamento de:"
4.11.2.4.1,prejuízos advindos do não cumprimento do objeto do contrato e do não adimplemento das demais obrigações nele previstas; 4.11.2.4.2. prejuízos diretos
4.11.2.4.3,multas moratórias e puni Ɵvas aplicadas pela Administração à contratada; e
4.11.2.4.4,"obrigações trabalhistas e previdenciárias de qualquer natureza e para com o FGTS, não adimplidas pela contratada, quando couber."
4.11.2.5,"A modalidade seguro-garan Ɵa somente será aceita se contemplar todos os eventos indicados no item anterior, observada a legislação que rege a matéria."
4.11.2.6,"A garan Ɵa em dinheiro deverá ser efetuada em favor da Contratante, em conta especíﬁca na Caixa Econômica Federal, com correção monetária."
4.11.2.7,"Caso a opção seja por u Ɵlizar ơtulos da dívida pública, estes devem ter sido emi Ɵdos sob a forma escritural, mediante registro em sistema centralizado de liquidação"
4.11.2.8,"No caso de garan Ɵa na modalidade de ﬁança bancária, deverá constar expressa renúncia do ﬁador aos bene İcios do ar Ɵgo 827 do Código Civil."
4.11.2.9,"No caso de alteração do valor do contrato, ou prorrogação de sua vigência, a garan Ɵa deverá ser ajustada à nova situação ou renovada, seguindo os mesmos"
4.11.2.10,"Se o valor da garan Ɵa for uƟlizado total ou parcialmente em pagamento de qualquer obrigação, a Contratada obriga-se a fazer a respec Ɵva reposição no prazo"
4.11.2.11,A Contratante executará a garan Ɵa na forma prevista na legislação que rege a matéria.
4.11.2.12,Será considerada ex Ɵnta a garan Ɵa:
