Item Number,Context
1,DO OBJETO
1.1,O objeto da presente licitação é a escolha da proposta mais vantajosa para a contratação de solução para desenvolvimento e gestão de aplicações baseada em
1.2,"A licitação será dividida em grupos, formados por um ou mais itens, conforme tabela constante do Termo de Referência, facultando-se ao licitante a"
1.3,"O critério de julgamento adotado será o menor preço GLOBAL do grupo, observadas as exigências con Ɵdas neste Edital e seus Anexos quanto às especiﬁcações"
1.4,"Cada serviço ou produto do lote deverá estar discriminado em itens separados nas propostas de preços, de modo a permi Ɵr a idenƟﬁcação do seu preço"
2,DOS RECURSOS ORÇAMENTÁRIOS
2.1,"As despesas para atender a esta licitação estão programadas em dotação orçamentária própria, prevista no orçamento da União para o exercício de 2023 a"
3,DO CREDENCIAMENTO
3.1,"O Credenciamento é o nível básico do registro cadastral no SICAF, que permite a par Ɵcipação dos interessados na modalidade licitatória Pregão, em sua forma"
3.2,"O cadastro no SICAF deverá ser feito no Portal de Compras do Governo Federal, no sí Ɵo hƩps://www.gov.br/compras/pt-br/  por meio de cer Ɵﬁcado digital"
3.4,"O licitante responsabiliza-se exclusiva e formalmente pelas transações efetuadas em seu nome, assume como ﬁrmes e verdadeiras suas propostas e seus"
3.5,É de responsabilidade do cadastrado conferir a exa Ɵdão dos seus dados cadastrais no SICAF e mantê-los atualizados junto aos órgãos responsáveis pela
3.5.1,A não observância do disposto no subitem anterior poderá ensejar desclassiﬁcação no momento da habilitação.
4,DA PARTICIPAÇÃO NO PREGÃO.
4.1,"Poderão par Ɵcipar deste Pregão interessados cujo ramo de a Ɵvidade seja compa ơvel com o objeto desta licitação, e que estejam com Credenciamento regular"
4.1.1,Os licitantes deverão u Ɵlizar o cer Ɵﬁcado digital para acesso ao Sistema
4.1.2,"Será concedido tratamento favorecido para as microempresas e empresas de pequeno porte, para as sociedades coopera Ɵvas mencionadas no ar Ɵgo 34"
4.2,Não poderão par Ɵcipar desta licitação os interessados:
4.2.1,"proibidos de par Ɵcipar de licitações e celebrar contratos administra Ɵvos, na forma da legislação vigente;"
4.2.2,que não atendam às condições deste Edital e seu(s) anexo(s);
4.2.3,estrangeiros que não tenham representação legal no Brasil com poderes expressos para receber citação e responder administra Ɵva ou judicialmente;
4.2.4,"que se enquadrem nas vedações previstas no ar Ɵgo 9º da Lei nº 8.666, de 1993;"
4.2.5,"que estejam sob falência, concurso de credores ou insolvência, em processo de dissolução ou liquidação;"
4.2.6,en Ɵdades empresariais que estejam reunidas em consórcio;
4.2.7,"organizações da Sociedade Civil de Interesse Público - OSCIP, atuando nessa condição (Acórdão nº 746/2014-TCU-Plenário);"
4.2.8,"sociedades coopera Ɵvas, considerando a vedação con Ɵda no art. 10 da Instrução Norma Ɵva SEGES/MP nº 5, de 2017."
4.3,"Nos termos do art. 5º do Decreto nº 9.507, de 2018, é vedada a contratação de pessoa jurídica na qual haja administrador ou sócio com poder de direção,"
4.3.1,"Para os ﬁns do disposto neste item , considera-se familiar o cônjuge, o companheiro ou o parente em linha reta ou colateral, por consanguinidade ou"
4.4,"Nos termos do art. 7° do Decreto n° 7.203, de 2010, é vedada, ainda, a u Ɵlização, na execução dos serviços contratados, de empregado da futura Contratada"
4.5,"Como condição para par Ɵcipação no Pregão, o licitante assinalará “sim” ou “não” em campo próprio do sistema eletrônico, rela Ɵvo às seguintes declarações:"
4.5.1,"que cumpre os requisitos estabelecidos no ar Ɵgo 3° da Lei Complementar nº 123, de 2006, estando apto a usufruir do tratamento favorecido estabelecido"
4.5.1.1,"nos itens exclusivos para par Ɵcipação de microempresas e empresas de pequeno porte, a assinalação do campo “não” impedirá o prosseguimento"
4.5.1.2,"nos itens em que a par Ɵcipação não for exclusiva para microempresas e empresas de pequeno porte, a assinalação do campo “não” apenas"
4.5.2,que está ciente e concorda com as condições con Ɵdas no Edital e seus anexos;
4.5.3,que cumpre os requisitos para a habilitação deﬁnidos no Edital e que a proposta apresentada está em conformidade com as exigências editalícias;
4.5.4,"que inexistem fatos impedi Ɵvos para sua habilitação no certame, ciente da obrigatoriedade de declarar ocorrências posteriores;"
4.5.5,"que não emprega menor de 18 anos em trabalho noturno, perigoso ou insalubre e não emprega menor de 16 anos, salvo menor, a par Ɵr de 14 anos, na"
4.5.6,que a proposta foi elaborada de forma independente;
4.5.7,"que não possui, em sua cadeia produ Ɵva, empregados executando trabalho degradante ou forçado, observando o disposto nos incisos III e IV do art. 1º e"
4.5.8,que a solução é fornecida por empresas que comprovem cumprimento de reserva de cargos prevista em lei para pessoa com deﬁciência ou para
4.5.9,"que cumpre os requisitos do Decreto n. 7.174, de 2010, estando apto a usufruir dos critérios de preferência."
4.5.9.1,"a assinalação do campo “não” apenas produzirá o efeito de o licitante não ter direito ao tratamento favorecido previsto no Decreto nº 7.174, de"
4.6,A declaração falsa rela Ɵva ao cumprimento de qualquer condição sujeitará o licitante às sanções previstas em lei e neste Edital.
5,DA APRESENTAÇÃO DA PROPOSTA E DOS DOCUMENTOS DE HABILITAÇÃO
5.1,"Os licitantes encaminharão, exclusivamente por meio do sistema, concomitantemente com os documentos de habilitação exigidos no edital, proposta com a"
5.2,"O envio da proposta, acompanhada dos documentos de habilitação exigidos neste Edital, ocorrerá por meio de chave de acesso e senha."
5.3,"Os licitantes poderão deixar de apresentar os documentos de habilitação que constem do SICAF, assegurado aos demais licitantes o direito de acesso aos dados"
5.4,"As Microempresas e Empresas de Pequeno Porte deverão encaminhar a documentação de habilitação, ainda que haja alguma restrição de regularidade ﬁscal e"
5.5,"Incumbirá ao licitante acompanhar as operações no sistema eletrônico durante a sessão pública do Pregão, ﬁcando responsável pelo ônus decorrente da perda"
5.7,"Não será estabelecida, nessa etapa do certame, ordem de classiﬁcação entre as propostas apresentadas, o que somente ocorrerá após a realização dos"
5.8,Os documentos que compõem a proposta e a habilitação do licitante melhor classiﬁcado somente serão disponibilizados para avaliação do pregoeiro e para
6,DO PREENCHIMENTO DA PROPOSTA
6.1,"O licitante deverá enviar sua proposta mediante o preenchimento, no sistema eletrônico, dos seguintes campos:"
6.1.1,Valor unitário e global de cada item do grupo;
6.1.2,"Descriçãodo objeto, contendo as informações similares à especiﬁcação do Termo de Referência."
6.2,Todas as especiﬁcações do objeto con Ɵdas na proposta vinculam a Contratada.
6.3,"Nos valores propostos estarão inclusos todos os custos operacionais, encargos previdenciários, trabalhistas, tributários, comerciais e quaisquer outros que"
6.3.1,"A Contratada deverá arcar com o ônus decorrente de eventual equívoco no dimensionamento dos quan ƟtaƟvos de sua proposta, inclusive quanto aos"
6.3.2,"Caso o eventual equívoco no dimensionamento dos quan ƟtaƟvos se revele superior às necessidades da contratante, a Administração deverá efetuar o"
6.4,A empresa é a única responsável pela cotação correta dos encargos tributários. Em caso de erro ou cotação incompa ơvel com o regime tributário a que se
6.4.1,cotação de percentual menor que o adequado: o percentual será man Ɵdo durante toda a execução contratual;
6.4.2,"cotação de percentual maior que o adequado: o excesso será suprimido, unilateralmente, da planilha e haverá glosa, quando do pagamento, e/ou"
6.5,"Se o regime tributário da empresa implicar o recolhimento de tributos em percentuais variáveis, a cotação adequada será a que corresponde à média dos"
6.6,"Independentemente do percentual de tributo inserido na planilha, no pagamento dos serviços, serão re Ɵdos na fonte os percentuais estabelecidos na"
6.7,"A apresentação das propostas implica obrigatoriedade do cumprimento das disposições nelas con Ɵdas, em conformidade com o que dispõe o Termo de"
6.8,"Os preços ofertados, tanto na proposta inicial, quanto na etapa de lances, serão de exclusiva responsabilidade do licitante, não lhe assis Ɵndo o direito de"
6.9,"O prazo de validade da proposta não será inferior a 60 (sessenta) dias, a contar da data de sua apresentação."
6.10,"Os licitantes devem respeitar os preços máximos estabelecidos nas normas de regência de contratações públicas federais, quando par Ɵciparem de licitações"
6.10.1,O descumprimento das regras supramencionadas pela Administração por parte dos contratados pode ensejar a responsabilização pelo Tribunal de Contas
7,"ABERTURA DA SESSÃO, CLASSIFICAÇÃO DAS PROPOSTAS E FORMULAÇÃO DE LANCES"
7.1,"A abertura da presente licitação dar-se-á em sessão pública, por meio de sistema eletrônico, na data, horário e local indicados neste Edital."
7.2,"O Pregoeiro veriﬁcará as propostas apresentadas, desclassiﬁcando desde logo aquelas que não estejam em conformidade com os requisitos estabelecidos"
7.2.1,Também será desclassiﬁcada a proposta que idenƟﬁque o licitante.
7.2.2,"A desclassiﬁcação será sempre fundamentada e registrada no sistema, com acompanhamento em tempo real por todos os par Ɵcipantes."
7.2.3,"A não desclassiﬁcação da proposta não impede o seu julgamento deﬁni Ɵvo em sen Ɵdo contrário, levado a efeito na fase de aceitação."
7.3,"O sistema ordenará automa Ɵcamente as propostas classiﬁcadas, sendo que somente estas par Ɵciparão da fase de lances."
7.4,O sistema disponibilizará campo próprio para troca de mensagens entre o Pregoeiro e os licitantes.
7.5,"Iniciada a etapa compe ƟƟva, os licitantes deverão encaminhar lances exclusivamente por meio de sistema eletrônico, sendo imediatamente informados do seu"
7.5.1,O lance deverá ser ofertado pelo valor total de cada grupo de itens.
7.6,"Os licitantes poderão oferecer lances sucessivos, observando o horário ﬁxado para abertura da sessão e as regras estabelecidas no Edital."
7.7,O licitante somente poderá oferecer lance de valor inferior ou percentual de desconto superior ao úl Ɵmo por ele ofertado e registrado pelo sistema.
7.8,"O intervalo mínimo de diferença de valores ou percentuais entre os lances, que incidirá tanto em relação aos lances intermediários quanto em relação à"
7.9,"Será adotado para o envio de lances no pregão eletrônico o modo de disputa “aberto”, em que os licitantes apresentarão lances públicos e sucessivos, com"
7.10,"A etapa de lances da sessão pública terá duração de dez minutos e, após isso, será prorrogada automa Ɵcamente pelo sistema quando houver lance ofertado"
7.11,"A prorrogação automá Ɵca da etapa de lances, de que trata o item anterior, será de dois minutos e ocorrerá sucessivamente sempre que houver lances"
7.12,"Não havendo novos lances na forma estabelecida nos itens anteriores, a sessão pública encerrar-se-á automa Ɵcamente."
7.13,"Encerrada a fase compe ƟƟva sem que haja a prorrogação automá Ɵca pelo sistema, poderá o pregoeiro, assessorado pela equipe de apoio, jus Ɵﬁcadamente,"
7.14,"Não serão aceitos dois ou mais lances de mesmo valor, prevalecendo aquele que for recebido e registrado em primeiro lugar.SEI/ANS - 27143694 - Edital de Licitação https://sei.ans.gov.br/controlador.php?acao=documento_imprimir_w..."
7.16,"No caso de desconexão com o Pregoeiro, no decorrer da etapa compe ƟƟva do Pregão, o sistema eletrônico poderá permanecer acessível aos licitantes para a"
7.17,"Quando a desconexão do sistema eletrônico para o pregoeiro persis Ɵr por tempo superior a dez minutos, a sessão pública será suspensa e reiniciada somente"
7.18,"O critério de julgamento adotado será o menor preço, conforme deﬁnido neste Edital e seus anexos."
7.19,"Caso o licitante não apresente lances, concorrerá com o valor de sua proposta."
7.20,"Em relação a itens não exclusivos para par Ɵcipação de microempresas e empresas de pequeno porte, uma vez encerrada a etapa de lances, será efe Ɵvada a"
7.21,"Nessas condições, as propostas de microempresas e empresas de pequeno porte que se encontrarem na faixa de até 5% (cinco por cento) acima da melhor"
7.22,"A melhor classiﬁcada nos termos do item anterior terá o direito de encaminhar uma úl Ɵma oferta para desempate, obrigatoriamente em valor inferior ao da"
7.23,"Caso a microempresa ou a empresa de pequeno porte melhor classiﬁcada desista ou não se manifeste no prazo estabelecido, serão convocadas as demais"
7.24,No caso de equivalência dos valores apresentados pelas microempresas e empresas de pequeno porte que se encontrem nos intervalos estabelecidos nos
7.25,"Só poderá haver empate entre propostas iguais (não seguidas de lances), ou entre lances ﬁnais da fase fechada do modo de disputa aberto e fechado."
7.26,"Havendo eventual empate entre propostas ou lances, o critério de desempate será aquele previsto no art. 3º, § 2º, da Lei nº 8.666, de 1993, assegurando-se a"
7.26.1,por empresas brasileiras;
7.26.2,por empresas que invistam em pesquisa e no desenvolvimento de tecnologia no País;
7.26.3,por empresas que comprovem cumprimento de reserva de cargos prevista em lei para pessoa com deﬁciência ou para reabilitado da Previdência Social e
7.27,"Persis Ɵndo o empate, a proposta vencedora será sorteada pelo sistema eletrônico dentre as propostas ou os lances empatados."
7.28,"Encerrada a etapa de envio de lances da sessão pública, o pregoeiro deverá encaminhar, pelo sistema eletrônico, contraproposta ao licitante que tenha"
7.28.1,"A negociação será realizada por meio do sistema, podendo ser acompanhada pelos demais licitantes."
7.28.2,"O pregoeiro solicitará ao licitante melhor classiﬁcado que, no prazo de 2 (duas) horas, envie a proposta adequada ao úl Ɵmo lance ofertado após a"
7.28.3,"É facultado ao pregoeiro prorrogar o prazo estabelecido, a par Ɵr de solicitação fundamentada feita no chat pelo licitante, antes de ﬁndo o prazo."
7.29,"Após a negociação do preço, o Pregoeiro iniciará a fase de aceitação e julgamento da proposta."
8,DA ACEITABILIDADE DA PROPOSTA VENCEDORA.
8.1,"Encerrada a etapa de negociação, o pregoeiro examinará a proposta classiﬁcada em primeiro lugar quanto à adequação ao objeto e à compa Ɵbilidade do preço"
8.2,"A análise da exequibilidade da proposta de preços deverá ser realizada com o auxílio da Planilha de Custos e Formação de Preços, a ser preenchida pelo"
8.3,"A Planilha de Custos e Formação de Preços deverá ser encaminhada pelo licitante exclusivamente via sistema, no prazo de 2 (duas) horas, contado da"
8.4,A inexequibilidade dos valores referentes a itens isolados da Planilha de Custos e Formação de Preços não caracteriza mo Ɵvo suﬁciente para a desclassiﬁcação
8.5,"Será desclassiﬁcada a proposta ou o lance vencedor, nos termos do item 9.1 do Anexo VII-A da In SEGES/MP n. 5/2017, que:"
8.5.1,não es Ɵver em conformidade com os requisitos estabelecidos neste edital;
8.5.2,contenha vício insanável ou ilegalidade;
8.5.3,não apresente as especiﬁcações técnicas exigidas pelo Termo de Referência;
8.5.4,"apresentar preço ﬁnal superior ao preço máximo ﬁxado (Acórdão nº 1455/2018 -TCU - Plenário), percentual de desconto inferior ao mínimo exigido, ou"
8.5.4.1,"Quando o licitante não conseguir comprovar que possui ou possuirá recursos suﬁcientes para executar a contento o objeto, será considerada"
8.5.4.1.1,"for insuﬁciente para a cobertura dos custos da contratação, apresente preços global ou unitários simbólicos, irrisórios ou de valor zero,"
8.5.4.1.2,"um ou mais valores da planilha de custo que sejam inferiores àqueles ﬁxados em instrumentos de caráter norma Ɵvo obrigatório, tais como"
8.6,"Se houver indícios de inexequibilidade da proposta de preço, ou em caso da necessidade de esclarecimentos complementares, poderão ser efetuadas"
8.7,"Quando o licitante apresentar preço ﬁnal inferior a 30% (trinta por cento) da média dos preços ofertados para o mesmo item, e a inexequibilidade da proposta"
8.8,"Qualquer interessado poderá requerer que se realizem diligências para aferir a exequibilidade e a legalidade das propostas, devendo apresentar as provas ou"
8.8.1,"Na hipótese de necessidade de suspensão da sessão pública para a realização de diligências, com vistas ao saneamento das propostas, a sessão pública"
8.9.1,"É facultado ao pregoeiro prorrogar o prazo estabelecido, a par Ɵr de solicitação fundamentada feita no chat pelo licitante, antes de ﬁndo o prazo"
8.9.2,"Dentre os documentos passíveis de solicitação pelo Pregoeiro, destacam-se as planilhas de custo readequadas com o valor ﬁnal ofertado."
8.10,Todos os dados informados pelo licitante em sua planilha deverão reﬂe Ɵr com ﬁdelidade os custos especiﬁcados e a margem de lucro pretendida.
8.11,O Pregoeiro analisará a compa Ɵbilidade dos preços unitários apresentados na Planilha de Custos e Formação de Preços com aqueles pra Ɵcados no mercado em
8.12,"Erros no preenchimento da planilha não cons Ɵtuem moƟvo para a desclassiﬁcação da proposta. A planilha poderá ser ajustada pelo licitante, no prazo indicado"
8.12.1,O ajuste de que trata este disposi Ɵvo se limita a sanar erros ou falhas que não alterem a substância das propostas;
8.12.2,Considera-se erro no preenchimento da planilha passível de correção a indicação de recolhimento de impostos e contribuições na forma do Simples
8.13,"Para ﬁns de análise da proposta quanto ao cumprimento das especiﬁcações do objeto, poderá ser colhida a manifestação escrita do setor requisitante do"
8.14,"Se a proposta ou lance vencedor for desclassiﬁcado, o Pregoeiro examinará a proposta ou lance subsequente, e, assim sucessivamente, na ordem de"
8.15,"Havendo necessidade, o Pregoeiro suspenderá a sessão, informando no “chat” a nova data e horário para sua con Ɵnuidade."
8.16,"Nos itens não exclusivos para a par Ɵcipação de microempresas e empresas de pequeno porte, sempre que a proposta não for aceita, e antes de o Pregoeiro"
8.17,"Encerrada a análise quanto à aceitação da proposta, o pregoeiro veriﬁcará a habilitação do licitante, observado o disposto neste Edital."
9,DA HABILITAÇÃO
9.1,"Como condição prévia ao exame da documentação de habilitação do licitante detentor da proposta classiﬁcada em primeiro lugar, o Pregoeiro veriﬁcará o"
9.1.1,"Para a consulta de licitantes pessoa jurídica poderá haver a subs Ɵtuição das consultas das alíneas “b”, “c” e “d” acima pela Consulta Consolidada de"
9.1.2,"A consulta aos cadastros será realizada em nome da empresa licitante e também de seu sócio majoritário, por força do ar Ɵgo 12 da Lei n° 8.429, de"
9.1.2.1,"Caso conste na Consulta de Situação do Fornecedor a existência de Ocorrências Impedi Ɵvas Indiretas, o gestor diligenciará para veriﬁcar se"
9.1.2.1.1,"A tenta Ɵva de burla será veriﬁcada por meio dos vínculos societários, linhas de fornecimento similares, dentre outros."
9.1.2.1.2,O licitante será convocado para manifestação previamente à sua desclassiﬁcação.
9.1.3,"Constatada a existência de sanção, o Pregoeiro reputará o licitante inabilitado, por falta de condição de par Ɵcipação."
9.1.4,"No caso de inabilitação, haverá nova veriﬁcação, pelo sistema, da eventual ocorrência do empate ﬁcto, previsto nos arts. 44 e 45 da Lei Complementar nº 123,"
9.2,"Caso atendidas as condições de par Ɵcipação, a habilitação dos licitantes será veriﬁcada por meio do SICAF, nos documentos por ele abrangidos, em relação à"
9.2.1,"O interessado, para efeitos de habilitação prevista na Instrução Norma Ɵva SEGES/MP nº 03, de 2018 mediante u Ɵlização do sistema, deverá atender às"
9.2.2,"É dever do licitante atualizar previamente as comprovações constantes do SICAF para que estejam vigentes na data da abertura da sessão pública, ou"
9.2.3,"O descumprimento do subitem acima implicará a inabilitação do licitante, exceto se a consulta aos sí Ɵos eletrônicos oﬁciais emissores de cer Ɵdões feita"
9.3,"Havendo a necessidade de envio de documentos de habilitação complementares, necessários à conﬁrmação daqueles exigidos neste Edital e já"
9.4,Somente haverá a necessidade de comprovação do preenchimento de requisitos mediante apresentação dos documentos originais não-digitais quando houver
9.5,"Não serão aceitos documentos de habilitação com indicação de CNPJ/CPF diferentes, salvo aqueles legalmente permi Ɵdos."
9.6,"Se o licitante for a matriz, todos os documentos deverão estar em nome da matriz, e se o licitante for a ﬁlial, todos os documentos deverão estar em nome da"
9.6.1,"Serão aceitos registros de CNPJ de licitante matriz e ﬁlial com diferenças de números de documentos per Ɵnentes ao CND e ao CRF/FGTS, quando for"
9.7,"Ressalvado o disposto no item 5.3, os licitantes deverão encaminhar, nos termos deste Edital, a documentação relacionada nos itens a seguir, para ﬁns de"
9.8,Habilitação jurídica:
9.8.1,"no caso de empresário individual, inscrição no Registro Público de Empresas Mercan Ɵs, a cargo da Junta Comercial da respec Ɵva sede;"
9.8.2,"Em se tratando de Microempreendedor Individual – MEI: Cer Ɵﬁcado da Condição de Microempreendedor Individual - CCMEI, cuja aceitação ﬁcará"
9.8.3,"No caso de sociedade empresária ou empresa individual de responsabilidade limitada - EIRELI: ato cons ƟtuƟvo, estatuto ou contrato social em vigor,"
9.8.4,"inscrição no Registro Público de Empresas Mercan Ɵs onde opera, com averbação no Registro onde tem sede a matriz, no caso de ser o par ƟcipanteSEI/ANS - 27143694 - Edital de Licitação https://sei.ans.gov.br/controlador.php?acao=documento_imprimir_w..."
9.8.5,"No caso de sociedade simples: inscrição do ato cons ƟtuƟvo no Registro Civil das Pessoas Jurídicas do local de sua sede, acompanhada de prova da"
9.8.6,"decreto de autorização, em se tratando de sociedade empresária estrangeira em funcionamento no País;"
9.8.7,Os documentos acima deverão estar acompanhados de todas as alterações ou da consolidação respec Ɵva.
9.9,Regularidade ﬁscal e trabalhista:
9.9.1,"prova de inscrição no Cadastro Nacional de Pessoas Jurídicas ou no Cadastro de Pessoas Físicas, conforme o caso;"
9.9.2,"prova de regularidade ﬁscal perante a Fazenda Nacional, mediante apresentação de cer Ɵdão expedida conjuntamente pela Secretaria da Receita Federal"
9.9.3,prova de regularidade com o Fundo de Garan Ɵa do Tempo de Serviço (FGTS);
9.9.4,"prova de inexistência de débitos inadimplidos perante a Jus Ɵça do Trabalho, mediante a apresentação de cer Ɵdão nega Ɵva ou posi Ɵva com efeito de"
9.9.5,"prova de inscrição no cadastro de contribuintes municipal, rela Ɵvo ao domicílio ou sede do licitante, per Ɵnente ao seu ramo de a Ɵvidade e compa ơvel"
9.9.6,"prova de regularidade com a Fazenda Estadual do domicílio ou sede do licitante, rela Ɵva à aƟvidade em cujo exercício contrata ou concorre;"
9.9.7,"caso o licitante seja considerado isento dos tributos estaduais relacionados ao objeto licitatório, deverá comprovar tal condição mediante a apresentação"
9.9.8,"Quando se tratar da subcontratação prevista no art. 48, II, da Lei Complementar n. 123, de 2006, a licitante melhor classiﬁcada deverá, também,"
9.10,Qualiﬁcação Econômico-Financeira:
9.10.1,cer Ɵdão negaƟva de falência expedida pelo distribuidor da sede do licitante;
9.10.2,"balanço patrimonial e demonstrações contábeis do úl Ɵmo exercício social, já exigíveis e apresentados na forma da lei, que comprovem a boa situação"
9.10.2.1,"no caso de empresa cons Ɵtuída no exercício social vigente, admite-se a apresentação de balanço patrimonial e demonstrações contábeis referentes"
9.10.2.2,"é admissível o balanço intermediário, se decorrer de lei ou contrato/estatuto social."
9.10.3,"comprovação da boa situação ﬁnanceira da empresa mediante obtenção de índices de Liquidez Geral (LG), Solvência Geral (SG) e Liquidez Corrente (LC),"
9.10.4,"As empresas que apresentarem resultado inferior ou igual a 1 (um) em qualquer dos índices de Liquidez Geral (LG), Solvência Geral (SG) e Liquidez Corrente"
9.11,Qualiﬁcação Técnica:
9.11.1,"Comprovação de ap Ɵdão para a prestação dos serviços em caracterís Ɵcas, quan Ɵdades e prazos compa ơveis com o objeto desta licitação, mediante a"
9.11.1.1,"Para ﬁns da comprovação de que trata este subitem, os atestados deverão dizer respeito a serviços executados com as seguintes caracterís Ɵcas"
9.11.1.1.1,"Grupo 1: Atestados de capacidade técnica emi Ɵdos por pessoa jurídica de direito público ou privado, nacionais ou internacionais (em"
9.11.1.1.2,"Grupo 1: Atestados de capacidade técnica emi Ɵdos por pessoas jurídicas de direito público ou privado, nacionais ou internacionais (em"
9.11.1.1.3,"Grupo 2: Atestados de capacidade técnica emi Ɵdos por pessoa jurídica de direito público ou privado, nacionais ou internacionais (em"
